{
  "schema": "aibo.plugin-manifest/v1",
  "pluginId": "dev.aibo.echo",
  "version": "1.0.0",
  "displayName": "Echo Agent",
  "description": "A deterministic third-party fixture Agent for the P4.7 plugin contract.",
  "publisher": {
    "name": "Aibo contract fixtures"
  },
  "protocols": {
    "runtime": { "min": "1.0", "max": "1.0" },
    "view": { "min": "1.0", "max": "1.0" }
  },
  "platforms": ["darwin-arm64", "windows-x64"],
  "entrypoint": {
    "executable": "bin/echo-agent",
    "args": ["--stdio"]
  },
  "dependencies": [
    {
      "kind": "runtime",
      "name": "fixture-runtime",
      "versionRange": ">=1",
      "required": true
    }
  ],
  "resources": [
    {
      "id": "dev.aibo.echo.logo",
      "path": "resources/logo.svg",
      "mediaType": "image/svg+xml",
      "sha256": "0000000000000000000000000000000000000000000000000000000000000000"
    }
  ],
  "agents": [
    {
      "agentId": "dev.aibo.echo.agent",
      "displayName": "Echo Agent",
      "description": "Streams input back and exposes a small task view.",
      "capabilities": [
        "session.create",
        "session.resume",
        "session.close",
        "turn.send",
        "turn.cancel",
        "stream.text",
        "view.standard",
        "command.list",
        "approval.respond",
        "queue.manage",
        "ext.dev.aibo.echo.refresh"
      ],
      "requestedPermissions": [
        {
          "id": "workspace.read",
          "required": false,
          "reason": "Shows the workspace label in diagnostics."
        }
      ],
      "operations": [
        {
          "id": "ext.dev.aibo.echo.commands",
          "capability": "command.list",
          "inputSchema": { "type": "object", "additionalProperties": false },
          "outputSchema": {
            "type": "object",
            "additionalProperties": false,
            "required": ["commands"],
            "properties": { "commands": { "type": "array" } }
          }
        },
        {
          "id": "ext.dev.aibo.echo.refresh",
          "capability": "ext.dev.aibo.echo.refresh",
          "inputSchema": {
            "type": "object",
            "additionalProperties": false,
            "required": ["label"],
            "properties": { "label": { "type": "string", "minLength": 1, "maxLength": 80 } }
          },
          "outputSchema": {
            "type": "object",
            "additionalProperties": false,
            "required": ["cursor"],
            "properties": { "cursor": { "type": "integer", "minimum": 0 } }
          }
        }
      ],
      "views": [
        {
          "viewId": "dev.aibo.echo.tasks",
          "title": "Echo tasks",
          "requiredComponents": ["stack", "panel", "text", "badge", "button"]
        }
      ]
    }
  ]
}
